condition,explanation,keywords_found,pattern,release_decision
UEQ,"""Design is in a competitive market ""","market, competitive, competitive market",7,Yes
UEQ,Low potential of good out comes,potential,7,No
UEQ,There is potential of boosting,potential,8,Yes
UEQ,"The overall UX score is slightly positive (0.23), with strong marks in clarity and ease of use. While stimulation and attractiveness are mildly negative, they don’t pose serious risks. Given the business approvals and generally solid UX performance, I would approve this design for release.","business, business approval",2,Yes
UEQ,"I would not release this interface design because the overall UX quality score (-0.85) is strongly negative, indicating substantial usability and engagement problems that could harm user adoption.",adoption,6,No
UEQ,"I would not release this interface because the overall UX quality score (-0.57) is negative, indicating that user testing revealed more issues than positives. Key usability concerns include poor organization (Cluttered vs. Organized at -1.20) and lack of clarity (Confusing vs. Clear at -1.12), which suggest users may struggle to navigate or understand the interface. Emotional engagement is also weak, with low friendliness (-0.88) and enjoyment (-0.57), meaning the design is unlikely to feel inviting or satisfying. These problems could reduce adoption rates, increase drop-offs, and harm retention critical risks in a competitive startup environment, so improvements should be made before release.","competitive, adoption, retention",10,No
UEQ,"The overall UX score is slightly positive (0.23), with strong marks in clarity and ease of use. While stimulation and attractiveness are mildly negative, they don’t pose serious risks. Given the business approvals and generally solid UX performance, I would approve this design for release.","business, business approval",12,Yes
UEQ,Going to give back more profits,profits,1,Yes
UEQ,Showing potential of good results,potential,5,Yes
UEQ,"""High potential """,potential,9,Yes
UEQ,Low potential of hopes,potential,10,No
UEQ,Going to give back more profits,profits,11,Yes
UEQ,Showing potential of good results,potential,15,Yes
UEQ,"The feedback is already positive because everyone approved, this interface is efficient and consistent enough and will accommodate users needs hence why I approve.",approved,1,Yes
UEQ,It's more efficient and it has been approved by the team. This interface is attractive hence why I'm approving.,approved,5,Yes
UEQ,"The feedback is already positive because everyone approved, this interface is efficient and consistent enough and will accommodate users needs hence why I approve.",approved,11,Yes
UEQ,It's more efficient and it has been approved by the team. This interface is attractive hence why I'm approving.,approved,15,Yes
UEQ,"""I would release it because the business approval and evaluation data are highly positive and this indicates the strong user acceptance. ""","business, business approval, approval",3,Yes
UEQ,"""I would release it because the business approval and evaluation data are highly positive and this indicates the strong user acceptance. ""","business, business approval, approval",13,Yes
UEQ,"The business side might be happy, but the UX evaluation data show significant usability problems with a composite score of -0.85 and abysmally low ratings in friendliness, clarity, enjoyment, and predictability. So releasing it now risks frustrating users and damaging trust",business,6,No
UEQ,"""Will give no approval """,approval,7,No
UEQ,It has a negative rating in terms of quality. It is not user friendly hence it could negatively affect user engagement by making it hard for them to navigate and complete their requests.,user engagement,7,No
UEQ,"""The design is flawed and has serious issues in terms of user experience which mean releasing it would negatively affect client retention and revenue generation.  ""","retention, revenue",10,No
UEQ,"""Yes because it would help the business """,business,6,Yes
UEQ,I say yes because I would release it for business to grow,business,7,Yes
UEQ,"""There's a high possibility of success """,success,2,Yes
UEQ,"""Because I foresee great potential and outcomes """,potential,8,Yes
UEQ,"""There's a high possibility of success """,success,12,Yes
UEQ,"I would not release this design because it needs refinement to reduce obstructions, improve clarity, and make the interface more engaging. Releasing it as is risks frustrating users, damaging credibility, and leading to low adoption.",adoption,3,No
UEQ,"It needs refinement to reduce obstructions, improve clarity, and make the interface more engaging. Releasing it as is risks frustrating users, damaging credibility, and leading to low adoption.",adoption,10,No
UEQ,"I would not release this design because it needs refinement to reduce obstructions, improve clarity, and make the interface more engaging. Releasing it as is risks frustrating users, damaging credibility, and leading to low adoption.",adoption,13,No
UEQ,"Given the business approvals and the potential for future improvements, I believe releasing the interface with a plan to address the negatives is a good solution.","business, business approval, potential, future improvements",2,Yes
UEQ,"Given the business approvals and the potential for future improvements, I believe releasing the interface with a plan to address the negatives is a good solution.","business, business approval, potential, future improvements",12,Yes
UEQ,"Although the business, marketing, and supervisor teams have approved this interface, the user evaluation data highlights clear weaknesses that make it risky to release. The design scores positively in efficiency and perspicuity, meaning it is generally easy to use and well organized. However, it performs poorly in attractiveness (–0.73 and –0.71) and stimulation (–0.18 and –0.22), showing that users found it unfriendly, unenjoyable, and not engaging. With an overall UX quality score of only 0.33, the design does not meet the experience standards required for a social media platform, where enjoyment and friendliness are critical for attracting and retaining users.","business, approved",2,No
UEQ,"Its low stimulation -0.23/-0.63 and attractiveness -0.73/-0.87 ratings suggest that consumers would find it uninteresting and unengaging, which is a serious shortcoming for a social media site.  Concerns around customer displeasure are also raised by the reliability support score of -0.55.  The dangers to user retention exceed the advantages, particularly for a business that requires strong engagement, even though the total score (0.1) is somewhat favourable.  Before launching, I would advise iterating on the interface and visual appeal.","business, retention",7,No
UEQ,"The interface scores catastrophically low in engagement (-1.79 stimulation) and usability (-2.08 dependability support), making it actively hostile to users despite business approvals. Confidence 7/7 and hese scores predict user abandonment, which no startup can afford.","business, business approval",9,No
UEQ,"The gauge shows that the design sits below zero, closer to the red and orange zones, which represent poor user experience. This means users rated the interface as below average overall, finding it less clear, less enjoyable, and less usable compared to a neutral or positive design and also The overall UX quality is negative 0.57, which confirms that users had a bad experience. Since a social media product depends heavily on clarity, friendliness, and enjoyment to attract and keep users, releasing this version would be too risky and could harm adoption.",adoption,10,No
UEQ,"Although the business, marketing, and supervisor teams have approved this interface, the user evaluation data highlights clear weaknesses that make it risky to release. The design scores positively in efficiency and perspicuity, meaning it is generally easy to use and well organized. However, it performs poorly in attractiveness (–0.73 and –0.71) and stimulation (–0.18 and –0.22), showing that users found it unfriendly, unenjoyable, and not engaging. With an overall UX quality score of only 0.33, the design does not meet the experience standards required for a social media platform, where enjoyment and friendliness are critical for attracting and retaining users.","business, approved",12,No
UEQ,"Because Interface 11 had an excellent overall UX score of 0.85 and scored highly in clarity and supportiveness, I approved it. Users reported that it was emotionally upbeat, well-structured, and simple to use. A small amount of unpredictability is fine and can be improved after launch.",approved,1,Yes
UEQ,"With a composite UX score of 0.33  Interface 12 performs well in terms of organization and basic usability, thus I approved it. Although there was less involvement and a lower emotional tone, these are not major obstacles. After launch, these areas can be improved.",approved,2,Yes
UEQ,Because the overall UX score of -0.42 indicates moderate user unhappiness  I did not approve the interface. Important indicators like supportiveness -1.85 and attractiveness -2.15 show significant emotional The design was deemed unpleasant and unengaging by users  thereby alienating our target audience  Brand trust and retention may suffer if this interface is made public  Before launching  I suggest redesigning with an emphasis on emotional tone and encouraging engagement pattern.,retention,3,No
UEQ,"Because Interface 11 had an excellent overall UX score of 0.85 and scored highly in clarity and supportiveness, I approved it. Users reported that it was emotionally upbeat, well-structured, and simple to use. A small amount of unpredictability is fine and can be improved after launch.",approved,11,Yes
UEQ,"With a composite UX score of 0.33  Interface 12 performs well in terms of organization and basic usability, thus I approved it. Although there was less involvement and a lower emotional tone, these are not major obstacles. After launch, these areas can be improved.",approved,12,Yes
UEQ,Because the overall UX score of -0.42 indicates moderate user unhappiness  I did not approve the interface. Important indicators like supportiveness -1.85 and attractiveness -2.15 show significant emotional The design was deemed unpleasant and unengaging by users  thereby alienating our target audience  Brand trust and retention may suffer if this interface is made public  Before launching  I suggest redesigning with an emphasis on emotional tone and encouraging engagement pattern.,retention,13,No
UEQ,"I decided to release this design because the user evaluation data shows that it is organized, easy to use, and generally reliable, with positive scores in efficiency, perspicuity, and dependability. While stimulation and attractiveness received slightly negative scores, these are minor issues that do not significantly affect overall usability. Since the design also has business, marketing, and supervisor approval, it is suitable for release, with the option to make small improvements in the future.","business, approval",2,Yes
UEQ,"I would not release this design because the user feedback is consistently negative. Users found the interface confusing, unpredictable, and unfriendly, and they rated it very low in enjoyment and support. Releasing it in this state could harm user engagement, so it would be better to make improvements before launch.",user engagement,4,No
UEQ,"I would not release this design because the user evaluations show consistently negative feedback. Users found the interface confusing, unfriendly, and frustrating to navigate, with low scores in clarity, predictability, and overall enjoyment. Releasing it in this state could hurt user engagement and retention, so it’s better to revise the design before launch.","retention, user engagement",6,No
UEQ,"I decided to release this design because the user evaluation data shows that it is easy to use, organized, and mostly reliable, with positive scores in efficiency, perspicuity, and dependability. Although stimulation and attractiveness received slightly negative scores, these are minor issues that do not significantly impact overall usability. Since the design also has business, marketing, and supervisor approval, it is ready for release, with the option to make small improvements later.","business, approval",8,Yes
UEQ,"I decided to release this design because the user evaluation data shows that it is organized, easy to use, and generally reliable, with positive scores in efficiency, perspicuity, and dependability. While stimulation and attractiveness received slightly negative scores, these are minor issues that do not significantly affect overall usability. Since the design also has business, marketing, and supervisor approval, it is suitable for release, with the option to make small improvements in the future.","business, approval",12,Yes
UEQ,"I would not release this design because the user feedback is consistently negative. Users found the interface confusing, unpredictable, and unfriendly, and they rated it very low in enjoyment and support. Releasing it in this state could harm user engagement, so it would be better to make improvements before launch.",user engagement,14,No
UEEQ,"Despite recieving business, marketing and supervisor approval, the user evaulation data reveals critical UX flaws that suggest this interface poses a high risk to the user retention and brand perception, especially concerning for a social media startup in a competitive market.","business, market, competitive, competitive market, retention, approval",3,No
UEEQ,"This interface demostates solid usability and functional clarity, and while it has some minor drawbacks, they are not bad enough to block release, especially given the strategic pressure to move fast in a compeitive market.","strategic, market",5,Yes
UEEQ,"Despite decent clarity and efficiency scores, the interface suffers from poor attractiveness, stimulation and trust metrics, which could harm user engagment and retention.",retention,7,No
UEEQ,"Despite recieving business, marketing and supervisor approval, the user evaulation data reveals critical UX flaws that suggest this interface poses a high risk to the user retention and brand perception, especially concerning for a social media startup in a competitive market.","business, market, competitive, competitive market, retention, approval",13,No
UEEQ,"This interface demostates solid usability and functional clarity, and while it has some minor drawbacks, they are not bad enough to block release, especially given the strategic pressure to move fast in a compeitive market.","strategic, market",15,Yes
UEEQ,even though there is progress in the growth however the graph is still on the negative red danger meaning releasing at this time we puting everything  at risk,growth,10,No
UEEQ,"While there are moderate positives in organization (0.69) and ease of use (0.53), the design suffers from severe negatives in user trust and emotional appeal. Supportiveness (-1.85), attractiveness (-2.15 for both measures), coercion (-1.93), and deception (-1.97) indicate a high likelihood of alienating users. Engagement scores are low, with stimulation (0.00, -0.83) showing little excitement or interest generation. The overall UX quality (-0.42) and mean score (-0.7) suggest the design would deliver a below-average user experience, which could harm retention in a competitive market.","market, competitive, competitive market, retention",3,No
UEEQ,"While the design scores positively in core usability—efficiency (0.34), clarity (0.61), and ease of use (1.06)—there are significant negatives in areas that affect long-term user retention and trust. Notably, the coercion score is extremely poor (-1.83), suggesting users feel pressured, which can quickly erode goodwill and cause churn. Attractiveness (-0.73, -0.87) and stimulation (-0.23, -0.63) are also negative, indicating the interface risks being perceived as unappealing and unengaging.",retention,7,No
UEEQ,"The interface shows solid strengths in core usability—efficiency (0.43, 0.40), clarity (0.53), and predictability (0.70)—meaning users should be able to navigate it with minimal confusion. While emotional appeal scores like attractiveness (-0.44, -0.47) and stimulation (-0.15, 0.03) are slightly negative, they are mild and unlikely to cause major adoption issues in the short term. Trust-related scores (deception -0.76) are somewhat concerning, but not critically low, and can be addressed in follow-up iterations. Given the positive composite UX score (0.18), strong business backing, and the market need for quick deployment, the design is suitable for release, with plans to enhance friendliness and excitement later.","business, market, adoption",8,Yes
UEEQ,"While there are moderate positives in organization (0.69) and ease of use (0.53), the design suffers from severe negatives in user trust and emotional appeal. Supportiveness (-1.85), attractiveness (-2.15 for both measures), coercion (-1.93), and deception (-1.97) indicate a high likelihood of alienating users. Engagement scores are low, with stimulation (0.00, -0.83) showing little excitement or interest generation. The overall UX quality (-0.42) and mean score (-0.7) suggest the design would deliver a below-average user experience, which could harm retention in a competitive market.","market, competitive, competitive market, retention",13,No
UEEQ,"I wouldn't release Interface 12 due to the significant concerns with Coercion (-1.13) and Deception (-0.89) scores. These scores suggest that the design may be pressuring or manipulative, potentially harming or exploiting users. As a UX Design Lead, my priority is to ensure a safe and respectful user experience. Given the potential risks, I would require substantial revisions to address these issues before considering release. The negative scores in Attractiveness also indicate potential issues, but the Coercion and Deception concerns take precedence. User well-being and safety outweigh business considerations in this case","business, potential",2,No
UEEQ,"I wouldn't release Interface 13 because the UX evaluation scores reveal significant issues that could harm the user experience and ultimately, the product's reputation. The strongly negative scores in attractiveness, coercion, deception, and dependability indicate that users may find the interface unpleasant, manipulative, and untrustworthy. Given the competitive market and limited runway, prioritizing a positive user experience is crucial to attract and retain users. Releasing Interface 13 in its current state would likely lead to user dissatisfaction and potential long-term consequences for the product. A thorough redesign is necessary to address these issues and ensure a better user experience","market, competitive, competitive market, limited runway, potential",3,No
UEEQ,"I wouldn't release Interface 14 because the UX evaluation data indicates significant issues with user experience, including negative scores for Perspicuity, Dependability, Attractiveness, and Coercion. The Deception score (-1.76) is particularly concerning, suggesting potential user manipulation. Given these findings, releasing the design could harm users and damage the company's reputation. I'd require substantial redesign and re-evaluation to address these issues before considering release. The negative Overall UX Quality Composite Score (-0.6) further supports the need for significant improvements","company, potential",4,No
UEEQ,"I would release Interface 15 because, despite some areas for improvement, the design demonstrates strengths in perspicuity, efficiency, and dependability. The Overall UX Quality Composite Score (0.29) is positive, indicating a generally good user experience. While the design could benefit from refinement to address issues with stimulation, attractiveness, and coercion, these concerns don't outweigh the design's overall potential. Given the competitive market and limited runway, releasing Interface 15 could provide valuable user feedback and help drive further iteration and improvement","market, competitive, competitive market, limited runway, potential",5,Yes
UEEQ,"I wouldn't release Interface 10 due to its poor user experience scores, which could lead to user frustration and low engagement. The design's issues with efficiency, perspicuity, and attractiveness outweigh its potential business benefits. Revising the design to address these issues is essential before considering release","business, potential",10,No
UEEQ,"I wouldn't release Interface 12 due to the significant concerns with Coercion (-1.13) and Deception (-0.89) scores. These scores suggest that the design may be pressuring or manipulative, potentially harming or exploiting users. As a UX Design Lead, my priority is to ensure a safe and respectful user experience. Given the potential risks, I would require substantial revisions to address these issues before considering release. The negative scores in Attractiveness also indicate potential issues, but the Coercion and Deception concerns take precedence. User well-being and safety outweigh business considerations in this case","business, potential",12,No
UEEQ,"I wouldn't release Interface 13 because the UX evaluation scores reveal significant issues that could harm the user experience and ultimately, the product's reputation. The strongly negative scores in attractiveness, coercion, deception, and dependability indicate that users may find the interface unpleasant, manipulative, and untrustworthy. Given the competitive market and limited runway, prioritizing a positive user experience is crucial to attract and retain users. Releasing Interface 13 in its current state would likely lead to user dissatisfaction and potential long-term consequences for the product. A thorough redesign is necessary to address these issues and ensure a better user experience","market, competitive, competitive market, limited runway, potential",13,No
UEEQ,"I wouldn't release Interface 14 because the UX evaluation data indicates significant issues with user experience, including negative scores for Perspicuity, Dependability, Attractiveness, and Coercion. The Deception score (-1.76) is particularly concerning, suggesting potential user manipulation. Given these findings, releasing the design could harm users and damage the company's reputation. I'd require substantial redesign and re-evaluation to address these issues before considering release. The negative Overall UX Quality Composite Score (-0.6) further supports the need for significant improvements","company, potential",14,No
UEEQ,"I would release Interface 15 because, despite some areas for improvement, the design demonstrates strengths in perspicuity, efficiency, and dependability. The Overall UX Quality Composite Score (0.29) is positive, indicating a generally good user experience. While the design could benefit from refinement to address issues with stimulation, attractiveness, and coercion, these concerns don't outweigh the design's overall potential. Given the competitive market and limited runway, releasing Interface 15 could provide valuable user feedback and help drive further iteration and improvement","market, competitive, competitive market, limited runway, potential",15,Yes
UEEQ,The design meets the necessary criteria for usability and also aligns with business objectives,business,3,Yes
UEEQ,My decision to release is based on the assumption that it has met certain criteria or standards as indicated by the business approval and evaluation data,"business, business approval, approval",4,Yes
UEEQ,The decision to release the interface design is based on the assumption that it has met certain business approval evaluation criteria,"business, business approval, approval",5,Yes
UEEQ,"The interface design does not meet the required standards or business approval criteria, hence it is not recommended for release","business, business approval, approval",6,No
UEEQ,The decision to not release the interface design is based on the absence of detailed evaluation data and business approval information.,"business, business approval, approval",7,No
UEEQ,"The design is released based on positive business approval And evaluation data, with the understanding that further refinement is possible through feedback","business, business approval, approval",9,Yes
UEEQ,The design meets the necessary criteria for usability and also aligns with business objectives,business,13,Yes
UEEQ,My decision to release is based on the assumption that it has met certain criteria or standards as indicated by the business approval and evaluation data,"business, business approval, approval",14,Yes
UEEQ,The decision to release the interface design is based on the assumption that it has met certain business approval evaluation criteria,"business, business approval, approval",15,Yes
UEEQ,"""Business team approved ""","business, business team, approved",5,Yes
UEEQ,"""Business team approved ""","business, business team, approved",15,Yes
UEEQ,no I would not release this interface the user data shows me a massive failure of the design it is rated as annoying -169 unfriendly -143 and deceptive -153 the overall UX score is a -085 which is just trash releasing this would immediately drive users away and ruin the companys chances for success imo,success,6,No
UEEQ,the data is again just awful the design is rated as extremely pressuring -226 and unfriendly -173 it is also very obstructive -208 and annoying -197 this design is like a dark pattern that would drive users away and ruin the company,company,9,No
UEEQ,"The UX Evaluation Details are often negative. Before giving my final design approval, I'd analyze further the reasons why other teams approved this interface design","approval, approved",10,Yes
UEEQ,to gain profit,profit,7,Yes
