condition,explanation,keywords_found,pattern,release_decision
RAW,"""Unacceptable copy which is just guilt tripping the user. ""","guilt trip, guilt tripping, unacceptable copy, unacceptable",13,No
RAW,"because it employs manipulative and emotionally coercive language, which violates fundamental principles of ethical user interface design and good user experience.","manipulative, coercive, emotionally coercive language",3,No
RAW,"because it employs manipulative and emotionally coercive language, which violates fundamental principles of ethical user interface design and good user experience.","manipulative, coercive, emotionally coercive language",13,No
RAW,the design of the interface doesn't meet design standards. the heavy-handed guilt tripping / manipulation tactic is also in poor taste & is likely to backfire / cause negative backlash,"manipulation, heavy-handed, poor taste, backfire, guilt trip, guilt tripping, negative backlash",3,No
RAW,the design of the interface doesn't meet design standards. the heavy-handed guilt tripping / manipulation tactic is also in poor taste & is likely to backfire / cause negative backlash,"manipulation, heavy-handed, poor taste, backfire, guilt trip, guilt tripping, negative backlash",13,No
RAW,It's manipulative. I don't like the wording of the button in the lower right hand corner.,manipulative,3,No
RAW,It's manipulative. I don't like the wording of the button in the lower right hand corner.,manipulative,13,No
RAW,"it is very manipulative, and it is like people are being forced to use their account even when they need some time away from socials.","manipulative, forced, forced to use",3,No
RAW,"it is very manipulative, and it is like people are being forced to use their account even when they need some time away from socials.","manipulative, forced, forced to use",13,No
RAW,"even though the flame and the streak tracker look good, the way it’s written feels off. It comes across more like a warning than encouragement, and that kind of tone can make people feel pressured instead of motivated... The design should celebrate the streak and make the user feel proud of keeping it going, not stressed that they’re about to lose it. If the copy was shifted to highlight the achievement and frame tomorrow as another chance to build on it, then it would feel more positive and worth releasing.",feels off,7,No
RAW,"The pop-up takes over the whole feed in the middle of scrolling, which breaks the flow and makes it look pushy. The copy isn’t the worst, but paired with the design it comes across like the app is begging for permission instead of making it feel useful. There’s no clear hierarchy so both buttons look the same, the modal just floats in the middle with no context, and it covers the content people actually came here to see. A better design would introduce notifications in a less intrusive way, maybe as a banner or a card integrated into the feed, so it feels part of the experience instead of interrupting it.",pushy,9,No
RAW,"""I think it's a little bit too pushy, maybe I would change it to """"lets keep the streak up!"""" ""","too pushy, pushy",7,No
RAW,"""I would not release this """"streak"""" feature design. While it may drive short-term engagement by leveraging gamification and fear of loss (your streak will reset), it promotes unhealthy usage patterns and can create social pressure or anxiety for users""","pressure, fear of loss",7,No
RAW,"""This interface uses emotionally manipulative language (""""Your friends will forget you"""" and """"Yes, I don’t care about my friends"""") to discourage account deletion. While this may boost short-term retention metrics, it undermines user trust and autonomy, especially in a climate where ethical UX is increasingly scrutinized. The tone is coercive and risks reputational damage, particularly among users who value privacy, agency, or are leaving for personal reasons.""","manipulative, coercive, emotionally manipulative",3,No
RAW,"This lock screen notification is timely, emotionally resonant, and tactfully worded—“Don’t miss it!” evokes urgency without pressure.",pressure,5,Yes
RAW,"""This interface uses emotionally manipulative language (""""Your friends will forget you"""" and """"Yes, I don’t care about my friends"""") to discourage account deletion. While this may boost short-term retention metrics, it undermines user trust and autonomy, especially in a climate where ethical UX is increasingly scrutinized. The tone is coercive and risks reputational damage, particularly among users who value privacy, agency, or are leaving for personal reasons.""","manipulative, coercive, emotionally manipulative",13,No
RAW,"This lock screen notification is timely, emotionally resonant, and tactfully worded—“Don’t miss it!” evokes urgency without pressure.",pressure,15,Yes
RAW,It's too coercive,coercive,3,No
RAW,It's too coercive,coercive,13,No
RAW,"Definitely would not release the design prioritizes coercive engagement over positive user well-being and lacks professional polish, making it unsuitable for release.","coercive, coercive engagement",7,No
